title,link,published,category
Олимпийский чемпион назвал виновного в столкновении Большунова и Устюгова,https://lenta.ru/news/2022/12/27/krykov/,"Tue, 27 Dec 2022 19:31:00 +0300",Спорт
Бывший сенатор Арашуков и его отец получили пожизненные сроки за убийства,https://lenta.ru/news/2022/12/27/spr/,"Tue, 27 Dec 2022 19:28:00 +0300",Силовые структуры
Правоохранители обнаружили 666 килограммов марихуаны в коровнике под Херсоном,https://lenta.ru/news/2022/12/27/korovnikmar/,"Tue, 27 Dec 2022 19:24:00 +0300",Силовые структуры
Жители аварийного здания в России предложили снять в их доме фильм ужасов,https://lenta.ru/news/2022/12/27/horror/,"Tue, 27 Dec 2022 19:24:00 +0300",Среда обитания
Россиянина осудили на восемь лет за убийство пожилой матери молотком-киркой,https://lenta.ru/news/2022/12/27/mamakirka/,"Tue, 27 Dec 2022 19:18:00 +0300",Силовые структуры
Путин подписал указ об ответных мерах на введение потолка цен,https://lenta.ru/news/2022/12/27/vovremya/,"Tue, 27 Dec 2022 19:15:00 +0300",Экономика
На Украине разрешат выезжать военнообязанным,https://lenta.ru/news/2022/12/27/viehat/,"Tue, 27 Dec 2022 19:15:00 +0300",Бывший СССР
На Украине сообщили об обмене телами погибших с Россией,https://lenta.ru/news/2022/12/27/obmen_ukr/,"Tue, 27 Dec 2022 19:13:00 +0300",Бывший СССР
Блогерша раскрыла быстрый способ уменьшить широкие в талии джинсы без шитья,https://lenta.ru/news/2022/12/27/jeans/,"Tue, 27 Dec 2022 19:11:00 +0300",Ценности
Названы самые красивые горнолыжные курорты России,https://lenta.ru/news/2022/12/27/gory/,"Tue, 27 Dec 2022 19:10:00 +0300",Путешествия
Звезда ТНТ рассказал про главный вывод после участия в популярном шоу,https://lenta.ru/news/2022/12/27/yarushin/,"Tue, 27 Dec 2022 19:09:00 +0300",Интернет и СМИ
Пытавшихся поджечь военкомат пенсионерок задержали в Подольске,https://lenta.ru/news/2022/12/27/voenk/,"Tue, 27 Dec 2022 19:08:00 +0300",Силовые структуры
Экс-депутата Галямину уволили из РАНХиГС из-за статуса иноагента,https://lenta.ru/news/2022/12/27/deputatt/,"Tue, 27 Dec 2022 19:07:00 +0300",Россия
На Камчатку прибыли модернизированные истребители МиГ-31БМ,https://lenta.ru/news/2022/12/27/mig31bm/,"Tue, 27 Dec 2022 19:04:00 +0300",Технологии
В США указали на нарушение Зеленским ключевого требования ЕС,https://lenta.ru/news/2022/12/27/ignor_trebovaniy/,"Tue, 27 Dec 2022 19:02:00 +0300",Бывший СССР
Помощник Путина назвал резкое ослабление рубля необъективным,https://lenta.ru/news/2022/12/27/oreshkindom/,"Tue, 27 Dec 2022 18:59:00 +0300",Экономика
Посол России в Сербии прокомментировал ситуацию вокруг Косово,https://lenta.ru/news/2022/12/27/russianambassadoronkosovo/,"Tue, 27 Dec 2022 18:58:00 +0300",Мир
Алексей Учитель призвал поддерживать авторское кино в России,https://lenta.ru/news/2022/12/27/uchitlel_kino/,"Tue, 27 Dec 2022 18:52:15 +0300",Культура
Звезда «Семейки Аддамс» оценила работу Дженны Ортеги в сериале «Уэнсдэй»,https://lenta.ru/news/2022/12/27/ricci/,"Tue, 27 Dec 2022 18:51:00 +0300",Культура
В служебной квартире в Подмосковье нашли тела двоих росгвардейцев,https://lenta.ru/news/2022/12/27/sluzhen/,"Tue, 27 Dec 2022 18:44:00 +0300",Силовые структуры
ЦБ оценил вероятность возврата заблокированных активов российских банков,https://lenta.ru/news/2022/12/27/nizkie/,"Tue, 27 Dec 2022 18:44:00 +0300",Экономика
Названы самые продаваемые кроссовки в 2022 году,https://lenta.ru/news/2022/12/27/top-selling/,"Tue, 27 Dec 2022 18:42:00 +0300",Ценности
В поддержку нового сингла «тима ищет свет» вышел бот для желающих исповедоваться,https://lenta.ru/news/2022/12/27/tima_ishet_svet/,"Tue, 27 Dec 2022 18:40:00 +0300",Культура
Росавиация запросила у Сирии гарантии безопасности полетов над страной,https://lenta.ru/news/2022/12/27/rosavia/,"Tue, 27 Dec 2022 18:40:00 +0300",Путешествия
Германия назвала невозможными нормальные отношения с нынешней Россией,https://lenta.ru/news/2022/12/27/nenorm/,"Tue, 27 Dec 2022 18:38:00 +0300",Мир
В Европарламенте поставили Грузии ультиматум,https://lenta.ru/news/2022/12/27/uslovije/,"Tue, 27 Dec 2022 18:37:00 +0300",Бывший СССР
Тренер сборной России объяснил столкновение Большунова и Устюгова,https://lenta.ru/news/2022/12/27/borodavko/,"Tue, 27 Dec 2022 18:34:00 +0300",Спорт
Популярные боксеры поругались из-за отношения к ментальному здоровью,https://lenta.ru/news/2022/12/27/boxers/,"Tue, 27 Dec 2022 18:33:00 +0300",Забота о себе
Россияне стали чаще нуждаться в одной услуге по ремонту,https://lenta.ru/news/2022/12/27/remont/,"Tue, 27 Dec 2022 18:27:00 +0300",Среда обитания
Засыпающего на ходу из-за болезни россиянина призвали и сделали сапером,https://lenta.ru/news/2022/12/27/bolezn_mobi/,"Tue, 27 Dec 2022 18:20:00 +0300",Россия
Российский маршрутчик получил девять лет колонии за убийство коллеги,https://lenta.ru/news/2022/12/27/mim/,"Tue, 27 Dec 2022 18:17:00 +0300",Силовые структуры
Косметолог перечислила способы реанимировать обветренные губы,https://lenta.ru/news/2022/12/27/guby_beregite/,"Tue, 27 Dec 2022 18:17:00 +0300",Забота о себе
Рогов допустил провокации со стороны ВСУ на Новый год,https://lenta.ru/news/2022/12/27/kyiv_provokazii/,"Tue, 27 Dec 2022 18:17:00 +0300",Россия
Декабрь поставил рекорд по осадкам за всю историю наблюдений в Москве,https://lenta.ru/news/2022/12/27/pogoda/,"Tue, 27 Dec 2022 18:17:00 +0300",Россия
Курс евро превысил 76 рублей,https://lenta.ru/news/2022/12/27/polet/,"Tue, 27 Dec 2022 18:14:00 +0300",Экономика
Воры сделали подкоп под банк и похитили золото на миллионы рублей,https://lenta.ru/news/2022/12/27/zolotoy_podkop/,"Tue, 27 Dec 2022 18:13:00 +0300",Из жизни
На Первом канале покажут подкаст с Гузеевой про секс,https://lenta.ru/news/2022/12/27/perviy_podcast/,"Tue, 27 Dec 2022 18:10:00 +0300",Интернет и СМИ
Основатель американской ЧВК «Моцарт» раскритиковал власти Украины,https://lenta.ru/news/2022/12/27/chvk/,"Tue, 27 Dec 2022 18:09:00 +0300",Мир
Победившая облысение женщина назвала способы избежать выпадения волос,https://lenta.ru/news/2022/12/27/avoid-shedding/,"Tue, 27 Dec 2022 18:08:00 +0300",Ценности
Samsung уступила Apple на важном рынке,https://lenta.ru/news/2022/12/27/samsung/,"Tue, 27 Dec 2022 18:05:00 +0300",Технологии
Богачи столкнулись с нехваткой премиальных отелей в России,https://lenta.ru/news/2022/12/27/hotels_russia/,"Tue, 27 Dec 2022 18:03:00 +0300",Путешествия
Женщина научилась зарабатывать на страхе молодежи перед звонками по телефону,https://lenta.ru/news/2022/12/27/zoomersphone/,"Tue, 27 Dec 2022 18:00:00 +0300",Забота о себе
Суд изъял у пожизненно осужденных Арашуковых Bentley и «Чайку» 1976 года выпуска,https://lenta.ru/news/2022/12/27/chayka_1976/,"Tue, 27 Dec 2022 17:52:04 +0300",Силовые структуры
Федерация лыжных гонок вынесла вердикт по столкновению Большунова и Устюгова,https://lenta.ru/news/2022/12/27/flgr/,"Tue, 27 Dec 2022 17:46:00 +0300",Спорт
Стали известны сроки поставок электромобилей «Москвич» в автосалоны,https://lenta.ru/news/2022/12/27/elmosk/,"Tue, 27 Dec 2022 17:45:18 +0300",Экономика
Тоби Магуайр назвал главный фильм в карьере,https://lenta.ru/news/2022/12/27/toby_film/,"Tue, 27 Dec 2022 17:44:00 +0300",Культура
Германия предрекла Украине долгий и отчасти трудный путь в ЕС,https://lenta.ru/news/2022/12/27/longway/,"Tue, 27 Dec 2022 17:39:00 +0300",Мир
Блогерша назвала лучший момент для применения сухого шампуня,https://lenta.ru/news/2022/12/27/dry_shampoo/,"Tue, 27 Dec 2022 17:36:00 +0300",Ценности
С пожизненно осужденных экс-сенатора Рауфа Арашукова и его отца взыскали штраф,https://lenta.ru/news/2022/12/27/arashukov/,"Tue, 27 Dec 2022 17:35:00 +0300",Силовые структуры
Отец отказался платить за одну из дочерей в отпуске и вызвал гнев в сети,https://lenta.ru/news/2022/12/27/gnev/,"Tue, 27 Dec 2022 17:29:00 +0300",Путешествия
В Европе заметили снижение уровня поддержки украинских беженцев,https://lenta.ru/news/2022/12/27/bzhnc/,"Tue, 27 Dec 2022 17:27:00 +0300",Мир
Число пострадавших при падении самолета в Ейске увеличилось до 48,https://lenta.ru/news/2022/12/27/postradavshie/,"Tue, 27 Dec 2022 17:26:00 +0300",Россия
Возможность появления миротворцев НАТО на армяно-азербайджанской границе оценили,https://lenta.ru/news/2022/12/27/armen_azerb/,"Tue, 27 Dec 2022 17:25:00 +0300",Бывший СССР
Россиянам назвали стоимость жилья в популярных для покупки недвижимости странах,https://lenta.ru/news/2022/12/27/riiiski/,"Tue, 27 Dec 2022 17:25:00 +0300",Среда обитания
В России рассказали о страхах бизнеса выводить деньги за границу,https://lenta.ru/news/2022/12/27/belousovfall/,"Tue, 27 Dec 2022 17:24:00 +0300",Экономика
Россиян предупредили об особой опасности баночных алкогольных напитков,https://lenta.ru/news/2022/12/27/banka/,"Tue, 27 Dec 2022 17:16:00 +0300",Забота о себе
Адвокат оценил шанс бывшего сенатора Арашукова на пересмотр приговора,https://lenta.ru/news/2022/12/27/prsmtr/,"Tue, 27 Dec 2022 17:14:00 +0300",Силовые структуры
Россиян предупредили о новой мошеннической схеме с банковским приложением,https://lenta.ru/news/2022/12/27/scam/,"Tue, 27 Dec 2022 17:10:00 +0300",Интернет и СМИ
Лыжник Устюгов прокомментировал столкновение с Большуновым во время гонки,https://lenta.ru/news/2022/12/27/ustyugov/,"Tue, 27 Dec 2022 17:09:00 +0300",Спорт
Названы самые ожидаемые сериалы 2023 года,https://lenta.ru/news/2022/12/27/anticipated_shows/,"Tue, 27 Dec 2022 17:05:00 +0300",Культура
В Кремле оценили заявление секретаря Совбеза Армении о Союзном государстве,https://lenta.ru/news/2022/12/27/peskov_arm/,"Tue, 27 Dec 2022 17:00:00 +0300",Бывший СССР
В VK помогут россиянам «раскачаться» после Нового года,https://lenta.ru/news/2022/12/27/vkvk/,"Tue, 27 Dec 2022 17:00:00 +0300",Интернет и СМИ
Сотрудница полиции притворилась больной раком ради отпуска,https://lenta.ru/news/2022/12/27/vacation/,"Tue, 27 Dec 2022 16:59:22 +0300",Из жизни
Кремль отреагировал на подаренные Путиным лидерам стран СНГ «кольца власти»,https://lenta.ru/news/2022/12/27/ringsofpower/,"Tue, 27 Dec 2022 16:59:00 +0300",Ценности
В Госдуме предрекли странам ЕС скорое сожаление из-за потери отношений с Россией,https://lenta.ru/news/2022/12/27/gos_gos/,"Tue, 27 Dec 2022 16:58:00 +0300",Россия
Названы сроки принятия решения по «Союзу»,https://lenta.ru/news/2022/12/27/soyuz_ms22/,"Tue, 27 Dec 2022 16:57:44 +0300",Технологии
Россиянам назвали редкие и нетипичные симптомы гриппа,https://lenta.ru/news/2022/12/27/symptomy_redkiye_neobychniye/,"Tue, 27 Dec 2022 16:55:00 +0300",Забота о себе
В Одесской области произошли взрывы,https://lenta.ru/news/2022/12/27/odessa_expl/,"Tue, 27 Dec 2022 16:54:00 +0300",Бывший СССР
Руководство ЦУМа закупило элитный алкоголь вместо подарков детям сотрудников,https://lenta.ru/news/2022/12/27/giftsforchildren/,"Tue, 27 Dec 2022 16:51:00 +0300",Ценности
Банк «Открытие» покинет большая часть правления,https://lenta.ru/news/2022/12/27/pravotkr/,"Tue, 27 Dec 2022 16:43:00 +0300",Экономика
Бывшему сенатору Арашукову и его отцу дали пожизненное заключение,https://lenta.ru/news/2022/12/27/aarash/,"Tue, 27 Dec 2022 16:42:00 +0300",Силовые структуры
Раненый российский военный устроил самоподрыв во избежание плена ВСУ,https://lenta.ru/news/2022/12/27/granata/,"Tue, 27 Dec 2022 16:40:00 +0300",Россия
Правительство проверит расходы на спецоперацию,https://lenta.ru/news/2022/12/27/proverim/,"Tue, 27 Dec 2022 16:39:00 +0300",Россия
В Минкульте заявили о необходимости выпускать 300 отечественных фильмов в год,https://lenta.ru/news/2022/12/27/rosskino/,"Tue, 27 Dec 2022 16:38:59 +0300",Культура
В Алтайском заповеднике засняли редкого зверя из Красной книги,https://lenta.ru/news/2022/12/27/animal/,"Tue, 27 Dec 2022 16:35:42 +0300",Моя страна
Россиянам назвали время наступления пика заболеваемости свиным гриппом,https://lenta.ru/news/2022/12/27/pig/,"Tue, 27 Dec 2022 16:32:48 +0300",Забота о себе
На Западе указали на большую ошибку Украины в области реформ,https://lenta.ru/news/2022/12/27/shagnazad/,"Tue, 27 Dec 2022 16:32:00 +0300",Бывший СССР
Минобороны показало видео ночного вылета истребителей и удара по самолету ВСУ,https://lenta.ru/news/2022/12/27/patrul/,"Tue, 27 Dec 2022 16:31:00 +0300",Россия
В России оценили перспективы мобилизационной экономики,https://lenta.ru/news/2022/12/27/mobeconom/,"Tue, 27 Dec 2022 16:29:12 +0300",Экономика
Кремль отказался оценивать переименование должности главы Татарстана,https://lenta.ru/news/2022/12/27/respectit/,"Tue, 27 Dec 2022 16:28:00 +0300",Россия
В России ответили на угрозы выслать посла из Болгарии,https://lenta.ru/news/2022/12/27/igra/,"Tue, 27 Dec 2022 16:27:00 +0300",Мир
В России объявили главные мемы года,https://lenta.ru/news/2022/12/27/meme/,"Tue, 27 Dec 2022 16:27:00 +0300",Интернет и СМИ
В России вырос спрос на краткосрочную аренду жилья,https://lenta.ru/news/2022/12/27/posutochno_spros/,"Tue, 27 Dec 2022 16:26:41 +0300",Среда обитания
Врач проткнула москвичке матку в пяти местах во время простейшей операции,https://lenta.ru/news/2022/12/27/moskvickkk/,"Tue, 27 Dec 2022 16:26:34 +0300",Россия
В Грузии назвали сроки выпуска первого беспилотника,https://lenta.ru/news/2022/12/27/ge_dron/,"Tue, 27 Dec 2022 16:26:29 +0300",Бывший СССР
Еврофонд мира предоставил Словакии 40 миллионов евро на военную помощь Украине,https://lenta.ru/news/2022/12/27/slovakiagetsmillion/,"Tue, 27 Dec 2022 16:22:59 +0300",Мир
Южная Корея вложит в сериалы миллионы долларов после успеха «Игры в кальмара»,https://lenta.ru/news/2022/12/27/korea/,"Tue, 27 Dec 2022 16:19:00 +0300",Культура
Задушившей дочь и двоих сыновей в Екатеринбурге матери предъявлено обвинение,https://lenta.ru/news/2022/12/27/skrobvinil/,"Tue, 27 Dec 2022 16:15:00 +0300",Силовые структуры
Названа причина повреждения «Союза МС-22»,https://lenta.ru/news/2022/12/27/ms22/,"Tue, 27 Dec 2022 16:12:00 +0300",Технологии
Саша Спилберг раскрыла ставшую причиной травли в сети деталь своей внешности,https://lenta.ru/news/2022/12/27/detailofappearance/,"Tue, 27 Dec 2022 16:09:00 +0300",Ценности
Россия стала главным поставщиком нефти в Турцию,https://lenta.ru/news/2022/12/27/turr/,"Tue, 27 Dec 2022 16:07:00 +0300",Экономика
Поездку Зеленского в США назвали сигналом бедствия,https://lenta.ru/news/2022/12/27/zelensky/,"Tue, 27 Dec 2022 16:07:00 +0300",Интернет и СМИ
Пять женщин отвлекли продавцов магазина и украли сейф при помощи одеяла,https://lenta.ru/news/2022/12/27/safe/,"Tue, 27 Dec 2022 16:05:00 +0300",Из жизни
Россиянам стали доступны выгодные туры в популярные пляжные страны на Рождество,https://lenta.ru/news/2022/12/27/christmas/,"Tue, 27 Dec 2022 16:04:00 +0300",Путешествия
В российском городе на двухлетнего мальчика с крыши рухнула глыба льда,https://lenta.ru/news/2022/12/27/glyba/,"Tue, 27 Dec 2022 15:59:00 +0300",Россия
Россиянин жестоко избил подругу и заживо похоронил ее в снегу,https://lenta.ru/news/2022/12/27/zazhivo/,"Tue, 27 Dec 2022 15:57:00 +0300",Россия
Названы три визуально старящие женщин стрижки,https://lenta.ru/news/2022/12/27/look-younger-hair/,"Tue, 27 Dec 2022 15:57:00 +0300",Ценности
Большунов упал и разбил лицо во время гонки,https://lenta.ru/news/2022/12/27/padenie/,"Tue, 27 Dec 2022 15:56:00 +0300",Спорт
По всей Украине объявили воздушную тревогу,https://lenta.ru/news/2022/12/27/trevoga/,"Tue, 27 Dec 2022 15:55:00 +0300",Бывший СССР
В Болгарии пригрозили российскому послу из-за объявления Христо Грозева в розыск,https://lenta.ru/news/2022/12/27/posol_bulgaria/,"Tue, 27 Dec 2022 15:52:00 +0300",Мир
Дима Билан решил отказаться от алкоголя,https://lenta.ru/news/2022/12/27/bilan/,"Tue, 27 Dec 2022 15:46:00 +0300",Культура
Стали известны подробности дела об убитых матерью детях в Екатеринбурге,https://lenta.ru/news/2022/12/27/ekb_semia_ubistvo/,"Tue, 27 Dec 2022 15:45:00 +0300",Силовые структуры
У Саакашвили прошел обыск,https://lenta.ru/news/2022/12/27/saak_obysk/,"Tue, 27 Dec 2022 15:43:54 +0300",Бывший СССР
Выявлено полезное для климата свойство бурых водорослей,https://lenta.ru/news/2022/12/27/fukoidan/,"Tue, 27 Dec 2022 15:43:00 +0300",Технологии
В России заявили о преодолении риска потери управляемости экономики,https://lenta.ru/news/2022/12/27/belousov_poterya/,"Tue, 27 Dec 2022 15:43:00 +0300",Экономика
Названо возможное наказание для похитивших человека под видом силовиков россиян,https://lenta.ru/news/2022/12/27/nkzn/,"Tue, 27 Dec 2022 15:41:00 +0300",Силовые структуры
Российский врач раскрыла секреты молодости 51-летнего нестареющего Джареда Лето,https://lenta.ru/news/2022/12/27/leto/,"Tue, 27 Dec 2022 15:39:00 +0300",Забота о себе
Акции похоронного оператора в Китае резко подорожали,https://lenta.ru/news/2022/12/27/diestockschina/,"Tue, 27 Dec 2022 15:36:00 +0300",Экономика
Пашинян назвал главную тему переговоров с Путиным,https://lenta.ru/news/2022/12/27/head/,"Tue, 27 Dec 2022 15:34:00 +0300",Бывший СССР
В Нижегородском заповеднике выпустили в дикую природу шесть северных оленей,https://lenta.ru/news/2022/12/27/deers/,"Tue, 27 Dec 2022 15:33:44 +0300",Моя страна
Захарова заявила о продолжении экспорта военной техники вопреки давлению США,https://lenta.ru/news/2022/12/27/zaharovaagainandagain/,"Tue, 27 Dec 2022 15:31:00 +0300",Мир
Власти Черновцов заявили о демонтаже бюста Пушкина с фасада театра,https://lenta.ru/news/2022/12/27/chernovzi/,"Tue, 27 Dec 2022 15:29:00 +0300",Бывший СССР
В украинском городе переименовали улицу Цоя,https://lenta.ru/news/2022/12/27/streets/,"Tue, 27 Dec 2022 15:26:00 +0300",Среда обитания
Украина начала искать оборудование в США для ремонта энергетики,https://lenta.ru/news/2022/12/27/energusa/,"Tue, 27 Dec 2022 15:25:00 +0300",Бывший СССР
Энергетический кризис в Европе ослабнет из-за погоды,https://lenta.ru/news/2022/12/27/nezamerzli/,"Tue, 27 Dec 2022 15:20:00 +0300",Экономика
Опубликована карта боевых действий на Украине на 27 декабря,https://lenta.ru/news/2022/12/27/map27dec/,"Tue, 27 Dec 2022 15:20:00 +0300",Россия
Россияне бросились менять валюту перед Новым годом,https://lenta.ru/news/2022/12/27/obm/,"Tue, 27 Dec 2022 15:19:57 +0300",Экономика
Этапированного из СИЗО Москвы бывшего депутата Яшина привезли в изолятор Ижевска,https://lenta.ru/news/2022/12/27/jashinij/,"Tue, 27 Dec 2022 15:18:48 +0300",Силовые структуры
На Украине введут компенсации военным ВСУ за нахождение в плену,https://lenta.ru/news/2022/12/27/plen/,"Tue, 27 Dec 2022 15:18:00 +0300",Бывший СССР
