title,link,published,category
Песков оценил вероятность переговоров с Украиной на условиях Киева,https://lenta.ru/news/2022/12/26/peskov/,"Mon, 26 Dec 2022 22:15:00 +0300",Россия
Супруга Байдена рассказала о традиционном подарке от мужа на Рождество,https://lenta.ru/news/2022/12/26/wife_biden/,"Mon, 26 Dec 2022 22:13:00 +0300",Мир
Власти Энгельса объяснили объявление воздушной тревоги,https://lenta.ru/news/2022/12/26/engg/,"Mon, 26 Dec 2022 22:12:00 +0300",Россия
Клуб АПЛ решил избавиться от футболиста сборной Аргентины из-за финала ЧМ-2022,https://lenta.ru/news/2022/12/26/emeri/,"Mon, 26 Dec 2022 22:10:00 +0300",Спорт
Слоны затоптали отправившегося на пикник мужчину,https://lenta.ru/news/2022/12/26/killer_elephant/,"Mon, 26 Dec 2022 22:00:00 +0300",Из жизни
В МИД назвали единственный способ вернуть права русскоязычным на Украине,https://lenta.ru/news/2022/12/26/prava/,"Mon, 26 Dec 2022 21:59:00 +0300",Мир
Медведев опубликовал прогноз на 2023 год,https://lenta.ru/news/2022/12/26/mddvv/,"Mon, 26 Dec 2022 21:45:00 +0300",Россия
Во Франции заявили о страхе рынка перед снижением добычи нефти в России,https://lenta.ru/news/2022/12/26/france/,"Mon, 26 Dec 2022 21:39:14 +0300",Экономика
Названы качества идеального матраса от боли в спине,https://lenta.ru/news/2022/12/26/mattress/,"Mon, 26 Dec 2022 21:30:00 +0300",Забота о себе
На Украине захотели провести мирный саммит на площадке ООН,https://lenta.ru/news/2022/12/26/mirsam/,"Mon, 26 Dec 2022 21:16:00 +0300",Бывший СССР
В Польше объяснили сдачу военных ВСУ в плен при первой возможности,https://lenta.ru/news/2022/12/26/vvssuu/,"Mon, 26 Dec 2022 21:16:00 +0300",Интернет и СМИ
Вышедший из тюрьмы серийный убийца Бикини-киллер решил засудить Netflix и Непал,https://lenta.ru/news/2022/12/26/bikinikiller/,"Mon, 26 Dec 2022 21:05:00 +0300",Из жизни
Россиянин зарезал 36-летнего брата во время ссоры и попал в СИЗО,https://lenta.ru/news/2022/12/26/bratarez/,"Mon, 26 Dec 2022 21:01:00 +0300",Силовые структуры
Плющенко рассказал о тратящем 150 тысяч рублей на игрушки сыне,https://lenta.ru/news/2022/12/26/plusch/,"Mon, 26 Dec 2022 21:01:00 +0300",Спорт
На границе Белоруссии и Украины открыли новую погранзаставу,https://lenta.ru/news/2022/12/26/pogranbel/,"Mon, 26 Dec 2022 21:01:00 +0300",Бывший СССР
«Меркурий» поразил мишень в ходе госиспытаний,https://lenta.ru/news/2022/12/26/20380/,"Mon, 26 Dec 2022 20:55:00 +0300",Технологии
Эрдоган понадеялся на инфляцию в Турции ниже 30 процентов,https://lenta.ru/news/2022/12/26/nizhe/,"Mon, 26 Dec 2022 20:54:00 +0300",Экономика
Россиянам назвали оптимальную дозу алкоголя в новогоднюю ночь,https://lenta.ru/news/2022/12/26/liquor/,"Mon, 26 Dec 2022 20:51:00 +0300",Забота о себе
Мужчина решил пронести в аэропорт оружие и патроны в чемоданах детей и попался,https://lenta.ru/news/2022/12/26/patrony/,"Mon, 26 Dec 2022 20:50:00 +0300",Путешествия
Пара возненавидела песню Last Christmas и решила выкупить права на нее,https://lenta.ru/news/2022/12/26/last_christmaaaas/,"Mon, 26 Dec 2022 20:49:00 +0300",Культура
В дагестанской пещере нашли оставленный террористом схрон со взрывчаткой,https://lenta.ru/news/2022/12/26/dagestann/,"Mon, 26 Dec 2022 20:45:00 +0300",Силовые структуры
Французские врачи потребовали удвоить зарплаты,https://lenta.ru/news/2022/12/26/frenchmdsalary/,"Mon, 26 Dec 2022 20:43:00 +0300",Мир
Звезда «Кривого зеркала» рассказал о последних разговорах с Пономаренко,https://lenta.ru/news/2022/12/26/bandurin/,"Mon, 26 Dec 2022 20:40:00 +0300",Интернет и СМИ
Саакашвили поставил условие для сдачи теста на отравление,https://lenta.ru/news/2022/12/26/testsaaak/,"Mon, 26 Dec 2022 20:40:00 +0300",Бывший СССР
Стали известны запасы нового месторождения газа в Турции,https://lenta.ru/news/2022/12/26/erd/,"Mon, 26 Dec 2022 20:39:59 +0300",Экономика
Редкий крокодил прокусил розетку в зоопарке и погиб от удара током,https://lenta.ru/news/2022/12/26/crocodile/,"Mon, 26 Dec 2022 20:37:13 +0300",Из жизни
Россиянина осудили на 18 лет за совращение троих детей сожительницы,https://lenta.ru/news/2022/12/26/sovrsoj/,"Mon, 26 Dec 2022 20:30:58 +0300",Силовые структуры
В Харькове произошли взрывы,https://lenta.ru/news/2022/12/26/strana_kharkov/,"Mon, 26 Dec 2022 20:27:00 +0300",Бывший СССР
Обвиняемую в вымогательстве журналистку Баязитову оставили в СИЗО до февраля,https://lenta.ru/news/2022/12/26/bayazi/,"Mon, 26 Dec 2022 20:25:06 +0300",Силовые структуры
Перепутавший посадочную полосу и автомагистраль пилот взлетел в последний момент,https://lenta.ru/news/2022/12/26/pilot/,"Mon, 26 Dec 2022 20:25:00 +0300",Путешествия
Никас Сафронов рассказал о проблемах с недвижимостью в Турции,https://lenta.ru/news/2022/12/26/nikas_problem/,"Mon, 26 Dec 2022 20:24:39 +0300",Среда обитания
Ученые объяснили пользу воспоминаний о прошлых отношениях,https://lenta.ru/news/2022/12/26/exbf/,"Mon, 26 Dec 2022 20:19:00 +0300",Забота о себе
Девять россиян предстанут перед судом за участие в ячейке «Свидетелей Иеговы»,https://lenta.ru/news/2022/12/26/ieg/,"Mon, 26 Dec 2022 20:16:00 +0300",Силовые структуры
Рената Литвинова примерила наряд дочери-дизайнера из бюстгальтеров,https://lenta.ru/news/2022/12/26/litvinova/,"Mon, 26 Dec 2022 20:12:00 +0300",Ценности
Стало известно о прощании Пеле с семьей,https://lenta.ru/news/2022/12/26/pele/,"Mon, 26 Dec 2022 20:06:00 +0300",Спорт
Между КНДР и Южной Кореей допустили локальные боестолкновения,https://lenta.ru/news/2022/12/26/stolknovenia/,"Mon, 26 Dec 2022 20:05:00 +0300",Мир
«Роскосмос» рассказал о влиянии пролива хладагента из «Союза МС-22»,https://lenta.ru/news/2022/12/26/soyuz/,"Mon, 26 Dec 2022 20:05:00 +0300",Технологии
Бывший дворецкий Карла III научил выпивать по-королевски,https://lenta.ru/news/2022/12/26/exbatler/,"Mon, 26 Dec 2022 20:03:56 +0300",Из жизни
В Грузии депутаты перестали поддерживать Саакашвили голодовкой,https://lenta.ru/news/2022/12/26/golodd/,"Mon, 26 Dec 2022 20:02:00 +0300",Бывший СССР
Сотрудница офиса получила выговор от 50-летнего коллеги за неуместный наряд,https://lenta.ru/news/2022/12/26/dresscode/,"Mon, 26 Dec 2022 19:59:00 +0300",Ценности
В Тайване заявили о крупнейшем вторжении Китая в зону ПВО острова,https://lenta.ru/news/2022/12/26/greatestinvasionever/,"Mon, 26 Dec 2022 19:55:00 +0300",Мир
Замглавы управления цифровизации Росавиации отправили в СИЗО,https://lenta.ru/news/2022/12/26/sizo/,"Mon, 26 Dec 2022 19:54:00 +0300",Силовые структуры
Друг умершего в Индии российского депутата назвал вероятную причину его смерти,https://lenta.ru/news/2022/12/26/strange_india/,"Mon, 26 Dec 2022 19:52:00 +0300",Путешествия
Названы самые полезные для потенции витамины и продукты,https://lenta.ru/news/2022/12/26/healthyfood_men/,"Mon, 26 Dec 2022 19:52:00 +0300",Забота о себе
15-летний россиянин устроил GTA-заезд на машине матери и попал на видео,https://lenta.ru/news/2022/12/26/gta/,"Mon, 26 Dec 2022 19:47:00 +0300",Россия
Названа возможная причина объявления в розыск автора идеи по развитию России,https://lenta.ru/news/2022/12/26/davydov_rozysk/,"Mon, 26 Dec 2022 19:44:00 +0300",Силовые структуры
Российский полицейский во время отпуска нанял безработного для поджога кафе,https://lenta.ru/news/2022/12/26/podzhogcafe/,"Mon, 26 Dec 2022 19:42:00 +0300",Силовые структуры
Билл Гейтс потеряет сотни тысяч долларов на продаже дома,https://lenta.ru/news/2022/12/26/gates_ny/,"Mon, 26 Dec 2022 19:42:00 +0300",Среда обитания
Пара решила отметить помолвку и увидела смертельную схватку леопарда и медоеда,https://lenta.ru/news/2022/12/26/honey_badger/,"Mon, 26 Dec 2022 19:38:14 +0300",Из жизни
Алсу высказалась о смерти музыканта Александра Шевченко,https://lenta.ru/news/2022/12/26/alsou/,"Mon, 26 Dec 2022 19:33:50 +0300",Культура
Глава ОКР оценил призыв Украины убрать Щербакову из номинантов на премию ISU,https://lenta.ru/news/2022/12/26/pozdnyakov/,"Mon, 26 Dec 2022 19:33:24 +0300",Спорт
Российский учитель ОБЖ совратил 15-летнюю школьницу,https://lenta.ru/news/2022/12/26/objshkol/,"Mon, 26 Dec 2022 19:32:19 +0300",Силовые структуры
Украина повысит тариф на транзит нефти по «Дружбе» на 18 процентов,https://lenta.ru/news/2022/12/26/transportirovka_nefti/,"Mon, 26 Dec 2022 19:31:45 +0300",Экономика
В Роспотребнадзоре прокомментировали заражения «пожирающей мозг» амебой в Корее,https://lenta.ru/news/2022/12/26/rospotreb/,"Mon, 26 Dec 2022 19:27:18 +0300",Россия
«ВКонтакте» опровергла сообщения о сбое,https://lenta.ru/news/2022/12/26/vk/,"Mon, 26 Dec 2022 19:27:00 +0300",Интернет и СМИ
Россиянам назвали способ продлить жизнь за четыре минуты в день,https://lenta.ru/news/2022/12/26/activity/,"Mon, 26 Dec 2022 19:23:42 +0300",Забота о себе
Рогозину удалили из позвоночника застрявший после обстрела ВСУ осколок снаряда,https://lenta.ru/news/2022/12/26/oskolok/,"Mon, 26 Dec 2022 19:21:00 +0300",Россия
Воры за две минуты ограбили отделение российского банка,https://lenta.ru/news/2022/12/26/vorybank/,"Mon, 26 Dec 2022 19:19:00 +0300",Силовые структуры
Девушка установила виниры в Турции и осталась с зубами разных цветов,https://lenta.ru/news/2022/12/26/veneers/,"Mon, 26 Dec 2022 19:16:00 +0300",Ценности
Украина призвала исключить Россию из ООН,https://lenta.ru/news/2022/12/26/un_ru_ua/,"Mon, 26 Dec 2022 19:15:00 +0300",Бывший СССР
Двое россиян предстанут перед судом по делу об убийстве и расчленении приятеля,https://lenta.ru/news/2022/12/26/sobut/,"Mon, 26 Dec 2022 19:07:00 +0300",Силовые структуры
Пассажиры устроили потасовку в летевшем из Европы самолете и сорвали рейс,https://lenta.ru/news/2022/12/26/air_moldova/,"Mon, 26 Dec 2022 19:04:00 +0300",Путешествия
Талибы опровергли запрет на получение образования женщинами,https://lenta.ru/news/2022/12/26/talibneprotiv/,"Mon, 26 Dec 2022 18:59:00 +0300",Мир
Россиянам назвали способы избежать мошенников при аренде жилья на Новый год,https://lenta.ru/news/2022/12/26/blackrealestatemarket/,"Mon, 26 Dec 2022 18:55:00 +0300",Россия
Следствие попросило арестовать замглавы управления цифровизации Росавиации,https://lenta.ru/news/2022/12/26/rosaviaz/,"Mon, 26 Dec 2022 18:54:00 +0300",Силовые структуры
В Южной Корее впервые зафиксировали заражение пожирающей мозг амебой,https://lenta.ru/news/2022/12/26/negleria/,"Mon, 26 Dec 2022 18:53:00 +0300",Технологии
Место убийства двоих сыновей и дочери их матерью попало на видео,https://lenta.ru/news/2022/12/26/videomama/,"Mon, 26 Dec 2022 18:53:00 +0300",Силовые структуры
На Украине назвали Киев городом-призраком,https://lenta.ru/news/2022/12/26/kievgorod/,"Mon, 26 Dec 2022 18:53:00 +0300",Бывший СССР
Бесплодная женщина забеременела благодаря обещанию сестры,https://lenta.ru/news/2022/12/26/sisters_gift/,"Mon, 26 Dec 2022 18:52:00 +0300",Из жизни
Крупную компанию по производству лифтов переименовали в России,https://lenta.ru/news/2022/12/26/lift_name/,"Mon, 26 Dec 2022 18:50:00 +0300",Среда обитания
Путин утвердил порядок подачи заявлений о нежелании быть гражданином Украины,https://lenta.ru/news/2022/12/26/grazhdanin/,"Mon, 26 Dec 2022 18:49:00 +0300",Россия
Украина захотела приостановить сотрудничество с Россией в сфере миграции,https://lenta.ru/news/2022/12/26/ukrsotrud/,"Mon, 26 Dec 2022 18:47:00 +0300",Бывший СССР
Назван виновник конфликта между Большуновым и Устюговым,https://lenta.ru/news/2022/12/26/ski_konflikt/,"Mon, 26 Dec 2022 18:46:00 +0300",Спорт
Еще одна российская авиакомпания отменила все рейсы в Египет,https://lenta.ru/news/2022/12/26/ifly_egypt/,"Mon, 26 Dec 2022 18:38:00 +0300",Путешествия
20-летний призывник ранил себя на глазах у матери в российском военкомате,https://lenta.ru/news/2022/12/26/ranil_syktyvkar/,"Mon, 26 Dec 2022 18:36:47 +0300",Россия
Военкор описал обстановку в районе Марьинки в ДНР,https://lenta.ru/news/2022/12/26/mari/,"Mon, 26 Dec 2022 18:35:44 +0300",Россия
Названы самые продаваемые художественные книги 2022 года,https://lenta.ru/news/2022/12/26/knigi2022/,"Mon, 26 Dec 2022 18:34:45 +0300",Культура
Россиян предупредили об опасных последствиях нехватки солнца,https://lenta.ru/news/2022/12/26/sun/,"Mon, 26 Dec 2022 18:32:14 +0300",Забота о себе
В Челябинске распечатали на 3D-принтере памятник лабораторной крысе,https://lenta.ru/news/2022/12/26/krisik/,"Mon, 26 Dec 2022 18:30:53 +0300",Моя страна
Столтенберг анонсировал вступление Швеции и Финляндии в НАТО в 2023 году,https://lenta.ru/news/2022/12/26/stoltenbergannounces/,"Mon, 26 Dec 2022 18:30:00 +0300",Мир
В Росавиации объяснили задержание недавно принятого на работу сотрудника,https://lenta.ru/news/2022/12/26/sledstv/,"Mon, 26 Dec 2022 18:29:00 +0300",Россия
Российским путешественникам рассказали о новых туристических налогах в 2023 году,https://lenta.ru/news/2022/12/26/nalog/,"Mon, 26 Dec 2022 18:25:09 +0300",Путешествия
В новой рекламе Gucci разглядели отсылки к России,https://lenta.ru/news/2022/12/26/guccirussia/,"Mon, 26 Dec 2022 18:24:41 +0300",Ценности
Российская порноактриса пожаловалась на свадебный подарок родителей,https://lenta.ru/news/2022/12/26/ally/,"Mon, 26 Dec 2022 18:24:08 +0300",Интернет и СМИ
В России в 2022 году изъяли около девяти тонн марихуаны,https://lenta.ru/news/2022/12/26/mar/,"Mon, 26 Dec 2022 18:19:00 +0300",Силовые структуры
В Росавиации прокомментировали сообщения об обыске у главы ведомства,https://lenta.ru/news/2022/12/26/oprrovv/,"Mon, 26 Dec 2022 18:15:00 +0300",Россия
Известная российская певица раскрыла подробности о квартире для годовалого сына,https://lenta.ru/news/2022/12/26/julianna_son/,"Mon, 26 Dec 2022 18:15:00 +0300",Среда обитания
На Кавказе восстановят высокогорную гостиницу СССР,https://lenta.ru/news/2022/12/26/priyut11/,"Mon, 26 Dec 2022 18:11:00 +0300",Моя страна
Захарова предупредила об угрозе масштабного конфликта в Косово,https://lenta.ru/news/2022/12/26/kosovo_conflict/,"Mon, 26 Dec 2022 18:05:00 +0300",Мир
Компьютерная программа создала из ДНК крошечные вазы и чаши,https://lenta.ru/news/2022/12/26/dnaxis/,"Mon, 26 Dec 2022 18:03:00 +0300",Технологии
В Раде заявили об обысках у главы администрации Днепропетровской области,https://lenta.ru/news/2022/12/26/obiskdnepr/,"Mon, 26 Dec 2022 18:01:00 +0300",Бывший СССР
Восемь машин столкнулись в ДТП под Москвой,https://lenta.ru/news/2022/12/26/dtp/,"Mon, 26 Dec 2022 18:00:00 +0300",Россия
Стала известна позиция ФИФА по участию России в отборе на ЧМ-2026,https://lenta.ru/news/2022/12/26/fifa_rus/,"Mon, 26 Dec 2022 17:58:00 +0300",Спорт
Компания друзей оставила официантке 150 тысяч рублей чаевых в честь праздников,https://lenta.ru/news/2022/12/26/bigtips/,"Mon, 26 Dec 2022 17:58:00 +0300",Из жизни
Стала известна стоимость нового электрического «Москвича»,https://lenta.ru/news/2022/12/26/moskvichnoo/,"Mon, 26 Dec 2022 17:58:00 +0300",Экономика
Убившая детей из-за «вселившихся в них бесов» россиянка оставила мужу записку,https://lenta.ru/news/2022/12/26/zapiska/,"Mon, 26 Dec 2022 17:56:00 +0300",Россия
Популярный блогер усомнился в честности розыгрышей гаджетов в соцсетях,https://lenta.ru/news/2022/12/26/petuhov/,"Mon, 26 Dec 2022 17:54:00 +0300",Интернет и СМИ
В США усомнились в существовании Украины как государства,https://lenta.ru/news/2022/12/26/ukrainanebudet/,"Mon, 26 Dec 2022 17:52:00 +0300",Мир
Возлюбленная Роналду показала на видео роскошный подарок футболисту на Рождество,https://lenta.ru/news/2022/12/26/giftedpartner1/,"Mon, 26 Dec 2022 17:52:00 +0300",Ценности
В Екатеринбурге мать убила троих детей при помощи провода,https://lenta.ru/news/2022/12/26/ekb/,"Mon, 26 Dec 2022 17:51:00 +0300",Силовые структуры
Диетолог дала совет по выбору рыбы для новогоднего стола,https://lenta.ru/news/2022/12/26/ryba/,"Mon, 26 Dec 2022 17:49:00 +0300",Забота о себе
В США десятки человек погибли из-за снежной бури,https://lenta.ru/news/2022/12/26/50_usa/,"Mon, 26 Dec 2022 17:39:00 +0300",Мир
В России исключили новогоднее перемирие с Украиной,https://lenta.ru/news/2022/12/26/bez_peremiriya/,"Mon, 26 Dec 2022 17:38:59 +0300",Бывший СССР
Путин назначил Медведева на должность своего первого заместителя в ВПК,https://lenta.ru/news/2022/12/26/putttin/,"Mon, 26 Dec 2022 17:36:00 +0300",Россия
Зеленский рассказал о переговорах с премьером Индии,https://lenta.ru/news/2022/12/26/ze_peace/,"Mon, 26 Dec 2022 17:30:39 +0300",Бывший СССР
Сестра Кейт Мосс объяснила причину нанесения тату на лицо после выхода из рехаба,https://lenta.ru/news/2022/12/26/rehab/,"Mon, 26 Dec 2022 17:28:00 +0300",Ценности
СКР возбудил дело из-за убийства россиянкой дочери и двоих сыновей,https://lenta.ru/news/2022/12/26/ekboficioz/,"Mon, 26 Dec 2022 17:26:00 +0300",Силовые структуры
Отдых россиянина на популярном отечественном курорте обернулся угрозой бешенства,https://lenta.ru/news/2022/12/26/dogs/,"Mon, 26 Dec 2022 17:24:00 +0300",Путешествия
В Казахстане признали роль русского языка,https://lenta.ru/news/2022/12/26/russlang/,"Mon, 26 Dec 2022 17:21:00 +0300",Бывший СССР
В Китае назвали дату открытия границ для туристов,https://lenta.ru/news/2022/12/26/china_travel/,"Mon, 26 Dec 2022 17:21:00 +0300",Путешествия
Леонардо Ди Каприо купил дом соседей после скандала с ними,https://lenta.ru/news/2022/12/26/leo_estate/,"Mon, 26 Dec 2022 17:20:00 +0300",Среда обитания
Опубликован список лучших рождественских фильмов,https://lenta.ru/news/2022/12/26/prazdnik_prihodit/,"Mon, 26 Dec 2022 17:18:00 +0300",Культура
Дженна Ортега отказалась читать строчку по сценарию сериала «Уэнсдэй»,https://lenta.ru/news/2022/12/26/ortegasline/,"Mon, 26 Dec 2022 17:16:00 +0300",Культура
Глава МВД заявил о задержании шестерых граждан с 260 килограммами наркотиков,https://lenta.ru/news/2022/12/26/mvdkolhark/,"Mon, 26 Dec 2022 17:13:27 +0300",Силовые структуры
В кабинете главы Росавиации провели обыск,https://lenta.ru/news/2022/12/26/neradko/,"Mon, 26 Dec 2022 17:13:00 +0300",Силовые структуры
Казахстан передал Украине электрогенераторы,https://lenta.ru/news/2022/12/26/electrokz/,"Mon, 26 Dec 2022 17:10:39 +0300",Бывший СССР
Китаю предсказали лидерство в мировой экономике к 2036 году,https://lenta.ru/news/2022/12/26/recidhfirm/,"Mon, 26 Dec 2022 17:09:00 +0300",Экономика
Отец Трусовой заявил о желании выбирать комментаторов на ее выступления,https://lenta.ru/news/2022/12/26/trusova/,"Mon, 26 Dec 2022 17:04:00 +0300",Спорт
Российские врачи вернули мужчине эрекцию с помощью передовой операции по ОМС,https://lenta.ru/news/2022/12/26/erection/,"Mon, 26 Dec 2022 16:59:00 +0300",Забота о себе
