title,link,published,category
Блогерша назвала лучший момент для применения сухого шампуня,https://lenta.ru/news/2022/12/27/dry_shampoo/,2022-12-27,Ценности
С пожизненно осужденных экс-сенатора Рауфа Арашукова и его отца взыскали штраф,https://lenta.ru/news/2022/12/27/arashukov/,2022-12-27,Силовые структуры
Отец отказался платить за одну из дочерей в отпуске и вызвал гнев в сети,https://lenta.ru/news/2022/12/27/gnev/,2022-12-27,Путешествия
В Европе заметили снижение уровня поддержки украинских беженцев,https://lenta.ru/news/2022/12/27/bzhnc/,2022-12-27,Мир
Число пострадавших при падении самолета в Ейске увеличилось до 48,https://lenta.ru/news/2022/12/27/postradavshie/,2022-12-27,Россия
Возможность появления миротворцев НАТО на армяно-азербайджанской границе оценили,https://lenta.ru/news/2022/12/27/armen_azerb/,2022-12-27,Бывший СССР
Россиянам назвали стоимость жилья в популярных для покупки недвижимости странах,https://lenta.ru/news/2022/12/27/riiiski/,2022-12-27,Среда обитания
В России рассказали о страхах бизнеса выводить деньги за границу,https://lenta.ru/news/2022/12/27/belousovfall/,2022-12-27,Экономика
Россиян предупредили об особой опасности баночных алкогольных напитков,https://lenta.ru/news/2022/12/27/banka/,2022-12-27,Забота о себе
Адвокат оценил шанс бывшего сенатора Арашукова на пересмотр приговора,https://lenta.ru/news/2022/12/27/prsmtr/,2022-12-27,Силовые структуры
Россиян предупредили о новой мошеннической схеме с банковским приложением,https://lenta.ru/news/2022/12/27/scam/,2022-12-27,Интернет и СМИ
Лыжник Устюгов прокомментировал столкновение с Большуновым во время гонки,https://lenta.ru/news/2022/12/27/ustyugov/,2022-12-27,Спорт
Названы самые ожидаемые сериалы 2023 года,https://lenta.ru/news/2022/12/27/anticipated_shows/,2022-12-27,Культура
В Кремле оценили заявление секретаря Совбеза Армении о Союзном государстве,https://lenta.ru/news/2022/12/27/peskov_arm/,2022-12-27,Бывший СССР
В VK помогут россиянам «раскачаться» после Нового года,https://lenta.ru/news/2022/12/27/vkvk/,2022-12-27,Интернет и СМИ
Сотрудница полиции притворилась больной раком ради отпуска,https://lenta.ru/news/2022/12/27/vacation/,2022-12-27,Из жизни
Кремль отреагировал на подаренные Путиным лидерам стран СНГ «кольца власти»,https://lenta.ru/news/2022/12/27/ringsofpower/,2022-12-27,Ценности
В Госдуме предрекли странам ЕС скорое сожаление из-за потери отношений с Россией,https://lenta.ru/news/2022/12/27/gos_gos/,2022-12-27,Россия
Названы сроки принятия решения по «Союзу»,https://lenta.ru/news/2022/12/27/soyuz_ms22/,2022-12-27,Технологии
Россиянам назвали редкие и нетипичные симптомы гриппа,https://lenta.ru/news/2022/12/27/symptomy_redkiye_neobychniye/,2022-12-27,Забота о себе
В Одесской области произошли взрывы,https://lenta.ru/news/2022/12/27/odessa_expl/,2022-12-27,Бывший СССР
Руководство ЦУМа закупило элитный алкоголь вместо подарков детям сотрудников,https://lenta.ru/news/2022/12/27/giftsforchildren/,2022-12-27,Ценности
Банк «Открытие» покинет большая часть правления,https://lenta.ru/news/2022/12/27/pravotkr/,2022-12-27,Экономика
Бывшему сенатору Арашукову и его отцу дали пожизненное заключение,https://lenta.ru/news/2022/12/27/aarash/,2022-12-27,Силовые структуры
Раненый российский военный устроил самоподрыв во избежание плена ВСУ,https://lenta.ru/news/2022/12/27/granata/,2022-12-27,Россия
Правительство проверит расходы на спецоперацию,https://lenta.ru/news/2022/12/27/proverim/,2022-12-27,Россия
В Минкульте заявили о необходимости выпускать 300 отечественных фильмов в год,https://lenta.ru/news/2022/12/27/rosskino/,2022-12-27,Культура
В Алтайском заповеднике засняли редкого зверя из Красной книги,https://lenta.ru/news/2022/12/27/animal/,2022-12-27,Моя страна
Россиянам назвали время наступления пика заболеваемости свиным гриппом,https://lenta.ru/news/2022/12/27/pig/,2022-12-27,Забота о себе
На Западе указали на большую ошибку Украины в области реформ,https://lenta.ru/news/2022/12/27/shagnazad/,2022-12-27,Бывший СССР
Минобороны показало видео ночного вылета истребителей и удара по самолету ВСУ,https://lenta.ru/news/2022/12/27/patrul/,2022-12-27,Россия
В России оценили перспективы мобилизационной экономики,https://lenta.ru/news/2022/12/27/mobeconom/,2022-12-27,Экономика
Кремль отказался оценивать переименование должности главы Татарстана,https://lenta.ru/news/2022/12/27/respectit/,2022-12-27,Россия
В России ответили на угрозы выслать посла из Болгарии,https://lenta.ru/news/2022/12/27/igra/,2022-12-27,Мир
В России объявили главные мемы года,https://lenta.ru/news/2022/12/27/meme/,2022-12-27,Интернет и СМИ
В России вырос спрос на краткосрочную аренду жилья,https://lenta.ru/news/2022/12/27/posutochno_spros/,2022-12-27,Среда обитания
Врач проткнула москвичке матку в пяти местах во время простейшей операции,https://lenta.ru/news/2022/12/27/moskvickkk/,2022-12-27,Россия
В Грузии назвали сроки выпуска первого беспилотника,https://lenta.ru/news/2022/12/27/ge_dron/,2022-12-27,Бывший СССР
Еврофонд мира предоставил Словакии 40 миллионов евро на военную помощь Украине,https://lenta.ru/news/2022/12/27/slovakiagetsmillion/,2022-12-27,Мир
Южная Корея вложит в сериалы миллионы долларов после успеха «Игры в кальмара»,https://lenta.ru/news/2022/12/27/korea/,2022-12-27,Культура
Задушившей дочь и двоих сыновей в Екатеринбурге матери предъявлено обвинение,https://lenta.ru/news/2022/12/27/skrobvinil/,2022-12-27,Силовые структуры
Названа причина повреждения «Союза МС-22»,https://lenta.ru/news/2022/12/27/ms22/,2022-12-27,Технологии
Саша Спилберг раскрыла ставшую причиной травли в сети деталь своей внешности,https://lenta.ru/news/2022/12/27/detailofappearance/,2022-12-27,Ценности
Россия стала главным поставщиком нефти в Турцию,https://lenta.ru/news/2022/12/27/turr/,2022-12-27,Экономика
Поездку Зеленского в США назвали сигналом бедствия,https://lenta.ru/news/2022/12/27/zelensky/,2022-12-27,Интернет и СМИ
Пять женщин отвлекли продавцов магазина и украли сейф при помощи одеяла,https://lenta.ru/news/2022/12/27/safe/,2022-12-27,Из жизни
Россиянам стали доступны выгодные туры в популярные пляжные страны на Рождество,https://lenta.ru/news/2022/12/27/christmas/,2022-12-27,Путешествия
В российском городе на двухлетнего мальчика с крыши рухнула глыба льда,https://lenta.ru/news/2022/12/27/glyba/,2022-12-27,Россия
Россиянин жестоко избил подругу и заживо похоронил ее в снегу,https://lenta.ru/news/2022/12/27/zazhivo/,2022-12-27,Россия
Названы три визуально старящие женщин стрижки,https://lenta.ru/news/2022/12/27/look-younger-hair/,2022-12-27,Ценности
Большунов упал и разбил лицо во время гонки,https://lenta.ru/news/2022/12/27/padenie/,2022-12-27,Спорт
По всей Украине объявили воздушную тревогу,https://lenta.ru/news/2022/12/27/trevoga/,2022-12-27,Бывший СССР
В Болгарии пригрозили российскому послу из-за объявления Христо Грозева в розыск,https://lenta.ru/news/2022/12/27/posol_bulgaria/,2022-12-27,Мир
Дима Билан решил отказаться от алкоголя,https://lenta.ru/news/2022/12/27/bilan/,2022-12-27,Культура
Стали известны подробности дела об убитых матерью детях в Екатеринбурге,https://lenta.ru/news/2022/12/27/ekb_semia_ubistvo/,2022-12-27,Силовые структуры
У Саакашвили прошел обыск,https://lenta.ru/news/2022/12/27/saak_obysk/,2022-12-27,Бывший СССР
Выявлено полезное для климата свойство бурых водорослей,https://lenta.ru/news/2022/12/27/fukoidan/,2022-12-27,Технологии
В России заявили о преодолении риска потери управляемости экономики,https://lenta.ru/news/2022/12/27/belousov_poterya/,2022-12-27,Экономика
Названо возможное наказание для похитивших человека под видом силовиков россиян,https://lenta.ru/news/2022/12/27/nkzn/,2022-12-27,Силовые структуры
Российский врач раскрыла секреты молодости 51-летнего нестареющего Джареда Лето,https://lenta.ru/news/2022/12/27/leto/,2022-12-27,Забота о себе
Акции похоронного оператора в Китае резко подорожали,https://lenta.ru/news/2022/12/27/diestockschina/,2022-12-27,Экономика
Пашинян назвал главную тему переговоров с Путиным,https://lenta.ru/news/2022/12/27/head/,2022-12-27,Бывший СССР
В Нижегородском заповеднике выпустили в дикую природу шесть северных оленей,https://lenta.ru/news/2022/12/27/deers/,2022-12-27,Моя страна
Захарова заявила о продолжении экспорта военной техники вопреки давлению США,https://lenta.ru/news/2022/12/27/zaharovaagainandagain/,2022-12-27,Мир
Власти Черновцов заявили о демонтаже бюста Пушкина с фасада театра,https://lenta.ru/news/2022/12/27/chernovzi/,2022-12-27,Бывший СССР
В украинском городе переименовали улицу Цоя,https://lenta.ru/news/2022/12/27/streets/,2022-12-27,Среда обитания
Украина начала искать оборудование в США для ремонта энергетики,https://lenta.ru/news/2022/12/27/energusa/,2022-12-27,Бывший СССР
Энергетический кризис в Европе ослабнет из-за погоды,https://lenta.ru/news/2022/12/27/nezamerzli/,2022-12-27,Экономика
Опубликована карта боевых действий на Украине на 27 декабря,https://lenta.ru/news/2022/12/27/map27dec/,2022-12-27,Россия
Россияне бросились менять валюту перед Новым годом,https://lenta.ru/news/2022/12/27/obm/,2022-12-27,Экономика
Этапированного из СИЗО Москвы бывшего депутата Яшина привезли в изолятор Ижевска,https://lenta.ru/news/2022/12/27/jashinij/,2022-12-27,Силовые структуры
На Украине введут компенсации военным ВСУ за нахождение в плену,https://lenta.ru/news/2022/12/27/plen/,2022-12-27,Бывший СССР
Косметолог раскрыла россиянкам способы уменьшить щеки,https://lenta.ru/news/2022/12/27/reducecheeks/,2022-12-27,Ценности
Более 30 рейсов отменили или задержали в аэропортах Москвы,https://lenta.ru/news/2022/12/27/msk/,2022-12-27,Путешествия
"Леопард пробрался в город, ранил 15 человек и попал на видео",https://lenta.ru/news/2022/12/27/leopard_attack/,2022-12-27,Из жизни
Кремль анонсировал поездку Путина в Псков,https://lenta.ru/news/2022/12/27/pskovss/,2022-12-27,Россия
Путин поговорил по телефону с восьмилетней девочкой из Запорожской области,https://lenta.ru/news/2022/12/27/putin_i_devochka/,2022-12-27,Россия
В ВСУ пожалели о захвате российской техники,https://lenta.ru/news/2022/12/27/vsu_troubles/,2022-12-27,Бывший СССР
Российского легкоатлета дисквалифицировали за допинг,https://lenta.ru/news/2022/12/27/doping/,2022-12-27,Спорт
Доверие финнов к правительству Санны Марин снизилось до рекордного минимума,https://lenta.ru/news/2022/12/27/sannamarin/,2022-12-27,Мир
Минцифры призвало одну категорию россиян обновить приложение «Госуслуги»,https://lenta.ru/news/2022/12/27/gosuslugi/,2022-12-27,Интернет и СМИ
Okko запустил уникальную систему рекомендаций для разного настроения и ситуаций,https://lenta.ru/news/2022/12/27/rec/,2022-12-27,Интернет и СМИ
На Украине уволили спецпредставителя по Приднестровью,https://lenta.ru/news/2022/12/27/ze_klimenko/,2022-12-27,Бывший СССР
Сербия начала возводить блокпосты на севере Косово,https://lenta.ru/news/2022/12/27/serbianblockpost/,2022-12-27,Мир
Перечислены самые ожидаемые смартфоны 2023 года,https://lenta.ru/news/2022/12/27/soon/,2022-12-27,Технологии
«Ситимобил» подал заявление в полицию из-за утечки данных,https://www.vedomosti.ru/technology/news/2022/12/27/957359-sitimobil-zayavlenie-politsiyu,2022-12-27,Технологии
МИД Украины заявил о «патологическом пренебрежении» Орбана к Киеву,https://www.vedomosti.ru/politics/news/2022/12/27/957357-mid-ukraini-patologicheskom-prenebrezhenii-orbana,2022-12-27,Политика
Минфин повысил минимальную розничную цену на игристые вина,https://www.vedomosti.ru/business/news/2022/12/27/957354-minfin-minimalnuyu-roznichnuyu-tsenu-igristie-vina,2022-12-27,Бизнес
МИД Болгарии вызвал российского посла после объявления в розыск Грозева,https://www.vedomosti.ru/politics/news/2022/12/27/957345-mid-bolgarii-rossiiskogo-posla,2022-12-27,Политика
Мишустин распорядился создать 16 военных учебных центров при федеральных вузах,https://www.vedomosti.ru/society/news/2022/12/27/957344-mishustin-16-voennih-uchebnih-tsentrov,2022-12-27,Общество
ЦБ предложил ввести потребительские кредиты для малоимущих заемщиков,https://www.vedomosti.ru/finance/news/2022/12/27/957342-tsb-predlozhil-potrebitelskie-krediti-maloimuschih-zaemschikov,2022-12-27,Финансы
Число жертв непогоды в США достигло 60,https://www.vedomosti.ru/society/news/2022/12/27/957341-chislo-zhertv,2022-12-27,Общество
KazanExpress может открыть первые в России бондовые склады в Казани и Москве,https://www.vedomosti.ru/business/news/2022/12/27/957340-kazanexpress-mozhet-otkrit,2022-12-27,Бизнес
Курс доллара превысил 71 рубль,https://www.vedomosti.ru/finance/news/2022/12/27/957331-kurs-dollara,2022-12-27,Финансы
Суд на Украине признал конституционным закон о переименовании УПЦ,https://www.vedomosti.ru/society/news/2022/12/27/957333-sud-na-ukraine,2022-12-27,Общество
Минприроды сообщило о переоформлении всех лицензий на недра на российские юрлица,https://www.vedomosti.ru/business/news/2022/12/27/957335-minprirodi-litsenzii-na-nedra,2022-12-27,Бизнес
Росавиация еще не получила от Сирии гарантий безопасного пролета,https://www.vedomosti.ru/society/news/2022/12/27/957330-rosaviatsiya-sirii-garantii-bezopasnogo-proleta,2022-12-27,Общество
Правительство выделило 34 млрд рублей на дотации приграничным регионам,https://www.vedomosti.ru/economics/news/2022/12/27/957325-pravitelstvo-videlilo-mlrd-dotatsii,2022-12-27,Экономика
Глава СПЧ анонсировал начало работы группы по вопросам СВО после Нового года,https://www.vedomosti.ru/society/news/2022/12/27/957314-glava-spch-anonsiroval-nachalo,2022-12-27,Общество
На Кубани сообщили о случаях оплаты украинской стороной фейков о спецоперации,https://www.vedomosti.ru/politics/news/2022/12/27/957322-na-kubani-soobschili-o-sluchayah,2022-12-27,Политика
Песков назвал подаренные лидерам стран СНГ перстни новогодними сувенирами,https://www.vedomosti.ru/politics/news/2022/12/27/957316-peskov-perstni,2022-12-27,Политика
В Кремле призвали с уважением относиться к переименованию должности главы Татарстана,https://www.vedomosti.ru/politics/news/2022/12/27/957311-v-kremle-prizvali-uvazheniem,2022-12-27,Политика
Песков: Россия не принуждает Армению присоединиться к Союзному государству,https://www.vedomosti.ru/politics/news/2022/12/27/957310-rossiya-ne-prinuzhdaet-armeniyu,2022-12-27,Политика
В ДНР заявили об отсутствии планов проводить массовые мероприятия на Новый год,https://www.vedomosti.ru/society/news/2022/12/27/957302-v-dnr-ob-otsutstvii-planov,2022-12-27,Общество
Правительство проверит расходование средств на нужды спецоперации,https://www.vedomosti.ru/politics/news/2022/12/27/957307-pravitelstvo-proverit-rashodovanie,2022-12-27,Политика
ФАС обвинила «Мегафон» в нарушении антимонопольного законодательства,https://www.vedomosti.ru/business/news/2022/12/27/957309-fas-megafon,2022-12-27,Бизнес
"Цены на жизненно важные лекарства выросли на 1,8% за 11 месяцев",https://www.vedomosti.ru/society/news/2022/12/27/957300-v-rossii-virosli,2022-12-27,Общество
Белоусов заявил о бессмысленности создания мобилизационной экономики в РФ,https://www.vedomosti.ru/economics/news/2022/12/27/957303-belousov-mobilizatsionnoi-ekonomiki,2022-12-27,Экономика
МИД подтвердил выполнение Россией всех обязательств по поставкам военной продукции,https://www.vedomosti.ru/politics/news/2022/12/27/957298-mid-podtverdil-vipolnenie-obyazatelstv,2022-12-27,Политика
Путин поговорил по телефону с загадавшей побывать в Крыму и у Деда Мороза девочкой,https://www.vedomosti.ru/society/news/2022/12/27/957289-putin-pogovoril-s-devochkoi,2022-12-27,Общество
Минобороны сообщило об уничтожении до 60 украинских военных на Донецком направлении,https://www.vedomosti.ru/politics/news/2022/12/27/957292-minoboroni-unichtozhenii-donetskom-napravlenii,2022-12-27,Политика
Яшина этапировали в СИЗО в Ижевске,https://www.vedomosti.ru/society/news/2022/12/27/957294-yashina-v-sizo,2022-12-27,Общество
Путин 28 декабря посетит завод «Титан-Полимер» в Псковской области,https://www.vedomosti.ru/politics/news/2022/12/27/957288-putin-titan-polimer,2022-12-27,Политика
Сирия открыла воздушное пространство для российских гражданских самолетов,https://www.vedomosti.ru/society/news/2022/12/27/957283-siriya-otkrila-vozdushnoe-prostranstvo,2022-12-27,Общество
Белоусов спрогнозировал инфляцию в России ниже прогноза в 2023 году,https://www.vedomosti.ru/economics/news/2022/12/27/957276-belousov-sprognoziroval-inflyatsiyu-v-rossii,2022-12-27,Экономика
"Белоусов заявил, что в 2023 году российской экономике будет легче",https://www.vedomosti.ru/economics/news/2022/12/27/957277-belousov-2023-godu-ekonomike-budet-legche,2022-12-27,Экономика
В Минсельхозе оценили ситуацию на рынке сахара,https://www.vedomosti.ru/economics/news/2022/12/27/957266-v-minselhoze-otsenili-situatsiyu-na-rinke-sahara,2022-12-27,Экономика
Минцифры рекомендовало обновить приложение «Госуслуги» на Android,https://www.vedomosti.ru/technology/news/2022/12/27/957269-mintsifri-gosuslugi-android,2022-12-27,Технологии
Spiegel: граф Ламбсдорф может стать новым послом Германии в Москве,https://www.vedomosti.ru/politics/news/2022/12/27/957261-graf-mozhet-stat-poslom,2022-12-27,Политика
СК возбудил уголовное дело после убийства семьи из восьми человек в Макеевке,https://www.vedomosti.ru/society/news/2022/12/27/957263-sk-ugolovnoe-delo-ubiistva-semi-makeevke,2022-12-27,Общество
В ЦБ назвали условия для смены доллара в экспортных контрактах на рубли,https://www.vedomosti.ru/finance/news/2022/12/27/957259-v-tsb-nazvali-usloviya,2022-12-27,Финансы
Тайвань увеличит срок службы в армии с 4 месяцев до года,https://www.vedomosti.ru/politics/news/2022/12/27/957253-taivan-uvelichit-srok,2022-12-27,Политика
Турпоток из России за границу вырос более чем на 20% в 2022 году,https://www.vedomosti.ru/society/news/2022/12/27/957250-turpotok-iz-rossii-viros,2022-12-27,Общество
Суд приговорил военного к году и восьми месяцам колонии за отказ от участия в СВО,https://www.vedomosti.ru/society/news/2022/12/27/957256-sud-prigovoril-voennogo,2022-12-27,Общество
