title,link,published,category
Песков оценил вероятность переговоров с Украиной на условиях Киева,https://lenta.ru/news/2022/12/26/peskov/,2022-12-26,Россия
Супруга Байдена рассказала о традиционном подарке от мужа на Рождество,https://lenta.ru/news/2022/12/26/wife_biden/,2022-12-26,Мир
Власти Энгельса объяснили объявление воздушной тревоги,https://lenta.ru/news/2022/12/26/engg/,2022-12-26,Россия
Клуб АПЛ решил избавиться от футболиста сборной Аргентины из-за финала ЧМ-2022,https://lenta.ru/news/2022/12/26/emeri/,2022-12-26,Спорт
Слоны затоптали отправившегося на пикник мужчину,https://lenta.ru/news/2022/12/26/killer_elephant/,2022-12-26,Из жизни
В МИД назвали единственный способ вернуть права русскоязычным на Украине,https://lenta.ru/news/2022/12/26/prava/,2022-12-26,Мир
Медведев опубликовал прогноз на 2023 год,https://lenta.ru/news/2022/12/26/mddvv/,2022-12-26,Россия
Во Франции заявили о страхе рынка перед снижением добычи нефти в России,https://lenta.ru/news/2022/12/26/france/,2022-12-26,Экономика
Названы качества идеального матраса от боли в спине,https://lenta.ru/news/2022/12/26/mattress/,2022-12-26,Забота о себе
На Украине захотели провести мирный саммит на площадке ООН,https://lenta.ru/news/2022/12/26/mirsam/,2022-12-26,Бывший СССР
В Польше объяснили сдачу военных ВСУ в плен при первой возможности,https://lenta.ru/news/2022/12/26/vvssuu/,2022-12-26,Интернет и СМИ
Вышедший из тюрьмы серийный убийца Бикини-киллер решил засудить Netflix и Непал,https://lenta.ru/news/2022/12/26/bikinikiller/,2022-12-26,Из жизни
Россиянин зарезал 36-летнего брата во время ссоры и попал в СИЗО,https://lenta.ru/news/2022/12/26/bratarez/,2022-12-26,Силовые структуры
Плющенко рассказал о тратящем 150 тысяч рублей на игрушки сыне,https://lenta.ru/news/2022/12/26/plusch/,2022-12-26,Спорт
На границе Белоруссии и Украины открыли новую погранзаставу,https://lenta.ru/news/2022/12/26/pogranbel/,2022-12-26,Бывший СССР
«Меркурий» поразил мишень в ходе госиспытаний,https://lenta.ru/news/2022/12/26/20380/,2022-12-26,Технологии
Эрдоган понадеялся на инфляцию в Турции ниже 30 процентов,https://lenta.ru/news/2022/12/26/nizhe/,2022-12-26,Экономика
Россиянам назвали оптимальную дозу алкоголя в новогоднюю ночь,https://lenta.ru/news/2022/12/26/liquor/,2022-12-26,Забота о себе
Мужчина решил пронести в аэропорт оружие и патроны в чемоданах детей и попался,https://lenta.ru/news/2022/12/26/patrony/,2022-12-26,Путешествия
Пара возненавидела песню Last Christmas и решила выкупить права на нее,https://lenta.ru/news/2022/12/26/last_christmaaaas/,2022-12-26,Культура
В дагестанской пещере нашли оставленный террористом схрон со взрывчаткой,https://lenta.ru/news/2022/12/26/dagestann/,2022-12-26,Силовые структуры
Французские врачи потребовали удвоить зарплаты,https://lenta.ru/news/2022/12/26/frenchmdsalary/,2022-12-26,Мир
Звезда «Кривого зеркала» рассказал о последних разговорах с Пономаренко,https://lenta.ru/news/2022/12/26/bandurin/,2022-12-26,Интернет и СМИ
Саакашвили поставил условие для сдачи теста на отравление,https://lenta.ru/news/2022/12/26/testsaaak/,2022-12-26,Бывший СССР
Стали известны запасы нового месторождения газа в Турции,https://lenta.ru/news/2022/12/26/erd/,2022-12-26,Экономика
Редкий крокодил прокусил розетку в зоопарке и погиб от удара током,https://lenta.ru/news/2022/12/26/crocodile/,2022-12-26,Из жизни
Россиянина осудили на 18 лет за совращение троих детей сожительницы,https://lenta.ru/news/2022/12/26/sovrsoj/,2022-12-26,Силовые структуры
В Харькове произошли взрывы,https://lenta.ru/news/2022/12/26/strana_kharkov/,2022-12-26,Бывший СССР
Обвиняемую в вымогательстве журналистку Баязитову оставили в СИЗО до февраля,https://lenta.ru/news/2022/12/26/bayazi/,2022-12-26,Силовые структуры
Перепутавший посадочную полосу и автомагистраль пилот взлетел в последний момент,https://lenta.ru/news/2022/12/26/pilot/,2022-12-26,Путешествия
Никас Сафронов рассказал о проблемах с недвижимостью в Турции,https://lenta.ru/news/2022/12/26/nikas_problem/,2022-12-26,Среда обитания
Ученые объяснили пользу воспоминаний о прошлых отношениях,https://lenta.ru/news/2022/12/26/exbf/,2022-12-26,Забота о себе
Девять россиян предстанут перед судом за участие в ячейке «Свидетелей Иеговы»,https://lenta.ru/news/2022/12/26/ieg/,2022-12-26,Силовые структуры
Рената Литвинова примерила наряд дочери-дизайнера из бюстгальтеров,https://lenta.ru/news/2022/12/26/litvinova/,2022-12-26,Ценности
Стало известно о прощании Пеле с семьей,https://lenta.ru/news/2022/12/26/pele/,2022-12-26,Спорт
Между КНДР и Южной Кореей допустили локальные боестолкновения,https://lenta.ru/news/2022/12/26/stolknovenia/,2022-12-26,Мир
«Роскосмос» рассказал о влиянии пролива хладагента из «Союза МС-22»,https://lenta.ru/news/2022/12/26/soyuz/,2022-12-26,Технологии
Бывший дворецкий Карла III научил выпивать по-королевски,https://lenta.ru/news/2022/12/26/exbatler/,2022-12-26,Из жизни
В Грузии депутаты перестали поддерживать Саакашвили голодовкой,https://lenta.ru/news/2022/12/26/golodd/,2022-12-26,Бывший СССР
Сотрудница офиса получила выговор от 50-летнего коллеги за неуместный наряд,https://lenta.ru/news/2022/12/26/dresscode/,2022-12-26,Ценности
В Тайване заявили о крупнейшем вторжении Китая в зону ПВО острова,https://lenta.ru/news/2022/12/26/greatestinvasionever/,2022-12-26,Мир
Замглавы управления цифровизации Росавиации отправили в СИЗО,https://lenta.ru/news/2022/12/26/sizo/,2022-12-26,Силовые структуры
Друг умершего в Индии российского депутата назвал вероятную причину его смерти,https://lenta.ru/news/2022/12/26/strange_india/,2022-12-26,Путешествия
Названы самые полезные для потенции витамины и продукты,https://lenta.ru/news/2022/12/26/healthyfood_men/,2022-12-26,Забота о себе
15-летний россиянин устроил GTA-заезд на машине матери и попал на видео,https://lenta.ru/news/2022/12/26/gta/,2022-12-26,Россия
Названа возможная причина объявления в розыск автора идеи по развитию России,https://lenta.ru/news/2022/12/26/davydov_rozysk/,2022-12-26,Силовые структуры
Российский полицейский во время отпуска нанял безработного для поджога кафе,https://lenta.ru/news/2022/12/26/podzhogcafe/,2022-12-26,Силовые структуры
Билл Гейтс потеряет сотни тысяч долларов на продаже дома,https://lenta.ru/news/2022/12/26/gates_ny/,2022-12-26,Среда обитания
Пара решила отметить помолвку и увидела смертельную схватку леопарда и медоеда,https://lenta.ru/news/2022/12/26/honey_badger/,2022-12-26,Из жизни
Алсу высказалась о смерти музыканта Александра Шевченко,https://lenta.ru/news/2022/12/26/alsou/,2022-12-26,Культура
Глава ОКР оценил призыв Украины убрать Щербакову из номинантов на премию ISU,https://lenta.ru/news/2022/12/26/pozdnyakov/,2022-12-26,Спорт
Российский учитель ОБЖ совратил 15-летнюю школьницу,https://lenta.ru/news/2022/12/26/objshkol/,2022-12-26,Силовые структуры
Украина повысит тариф на транзит нефти по «Дружбе» на 18 процентов,https://lenta.ru/news/2022/12/26/transportirovka_nefti/,2022-12-26,Экономика
В Роспотребнадзоре прокомментировали заражения «пожирающей мозг» амебой в Корее,https://lenta.ru/news/2022/12/26/rospotreb/,2022-12-26,Россия
«ВКонтакте» опровергла сообщения о сбое,https://lenta.ru/news/2022/12/26/vk/,2022-12-26,Интернет и СМИ
Россиянам назвали способ продлить жизнь за четыре минуты в день,https://lenta.ru/news/2022/12/26/activity/,2022-12-26,Забота о себе
Рогозину удалили из позвоночника застрявший после обстрела ВСУ осколок снаряда,https://lenta.ru/news/2022/12/26/oskolok/,2022-12-26,Россия
Воры за две минуты ограбили отделение российского банка,https://lenta.ru/news/2022/12/26/vorybank/,2022-12-26,Силовые структуры
Девушка установила виниры в Турции и осталась с зубами разных цветов,https://lenta.ru/news/2022/12/26/veneers/,2022-12-26,Ценности
Украина призвала исключить Россию из ООН,https://lenta.ru/news/2022/12/26/un_ru_ua/,2022-12-26,Бывший СССР
Двое россиян предстанут перед судом по делу об убийстве и расчленении приятеля,https://lenta.ru/news/2022/12/26/sobut/,2022-12-26,Силовые структуры
Пассажиры устроили потасовку в летевшем из Европы самолете и сорвали рейс,https://lenta.ru/news/2022/12/26/air_moldova/,2022-12-26,Путешествия
Талибы опровергли запрет на получение образования женщинами,https://lenta.ru/news/2022/12/26/talibneprotiv/,2022-12-26,Мир
Россиянам назвали способы избежать мошенников при аренде жилья на Новый год,https://lenta.ru/news/2022/12/26/blackrealestatemarket/,2022-12-26,Россия
Следствие попросило арестовать замглавы управления цифровизации Росавиации,https://lenta.ru/news/2022/12/26/rosaviaz/,2022-12-26,Силовые структуры
В Южной Корее впервые зафиксировали заражение пожирающей мозг амебой,https://lenta.ru/news/2022/12/26/negleria/,2022-12-26,Технологии
Место убийства двоих сыновей и дочери их матерью попало на видео,https://lenta.ru/news/2022/12/26/videomama/,2022-12-26,Силовые структуры
На Украине назвали Киев городом-призраком,https://lenta.ru/news/2022/12/26/kievgorod/,2022-12-26,Бывший СССР
Бесплодная женщина забеременела благодаря обещанию сестры,https://lenta.ru/news/2022/12/26/sisters_gift/,2022-12-26,Из жизни
Крупную компанию по производству лифтов переименовали в России,https://lenta.ru/news/2022/12/26/lift_name/,2022-12-26,Среда обитания
Путин утвердил порядок подачи заявлений о нежелании быть гражданином Украины,https://lenta.ru/news/2022/12/26/grazhdanin/,2022-12-26,Россия
Украина захотела приостановить сотрудничество с Россией в сфере миграции,https://lenta.ru/news/2022/12/26/ukrsotrud/,2022-12-26,Бывший СССР
Назван виновник конфликта между Большуновым и Устюговым,https://lenta.ru/news/2022/12/26/ski_konflikt/,2022-12-26,Спорт
Еще одна российская авиакомпания отменила все рейсы в Египет,https://lenta.ru/news/2022/12/26/ifly_egypt/,2022-12-26,Путешествия
20-летний призывник ранил себя на глазах у матери в российском военкомате,https://lenta.ru/news/2022/12/26/ranil_syktyvkar/,2022-12-26,Россия
Военкор описал обстановку в районе Марьинки в ДНР,https://lenta.ru/news/2022/12/26/mari/,2022-12-26,Россия
Названы самые продаваемые художественные книги 2022 года,https://lenta.ru/news/2022/12/26/knigi2022/,2022-12-26,Культура
Россиян предупредили об опасных последствиях нехватки солнца,https://lenta.ru/news/2022/12/26/sun/,2022-12-26,Забота о себе
В Челябинске распечатали на 3D-принтере памятник лабораторной крысе,https://lenta.ru/news/2022/12/26/krisik/,2022-12-26,Моя страна
Столтенберг анонсировал вступление Швеции и Финляндии в НАТО в 2023 году,https://lenta.ru/news/2022/12/26/stoltenbergannounces/,2022-12-26,Мир
В Росавиации объяснили задержание недавно принятого на работу сотрудника,https://lenta.ru/news/2022/12/26/sledstv/,2022-12-26,Россия
Российским путешественникам рассказали о новых туристических налогах в 2023 году,https://lenta.ru/news/2022/12/26/nalog/,2022-12-26,Путешествия
В новой рекламе Gucci разглядели отсылки к России,https://lenta.ru/news/2022/12/26/guccirussia/,2022-12-26,Ценности
Российская порноактриса пожаловалась на свадебный подарок родителей,https://lenta.ru/news/2022/12/26/ally/,2022-12-26,Интернет и СМИ
В России в 2022 году изъяли около девяти тонн марихуаны,https://lenta.ru/news/2022/12/26/mar/,2022-12-26,Силовые структуры
В Росавиации прокомментировали сообщения об обыске у главы ведомства,https://lenta.ru/news/2022/12/26/oprrovv/,2022-12-26,Россия
Известная российская певица раскрыла подробности о квартире для годовалого сына,https://lenta.ru/news/2022/12/26/julianna_son/,2022-12-26,Среда обитания
На Кавказе восстановят высокогорную гостиницу СССР,https://lenta.ru/news/2022/12/26/priyut11/,2022-12-26,Моя страна
Захарова предупредила об угрозе масштабного конфликта в Косово,https://lenta.ru/news/2022/12/26/kosovo_conflict/,2022-12-26,Мир
Компьютерная программа создала из ДНК крошечные вазы и чаши,https://lenta.ru/news/2022/12/26/dnaxis/,2022-12-26,Технологии
В Раде заявили об обысках у главы администрации Днепропетровской области,https://lenta.ru/news/2022/12/26/obiskdnepr/,2022-12-26,Бывший СССР
Восемь машин столкнулись в ДТП под Москвой,https://lenta.ru/news/2022/12/26/dtp/,2022-12-26,Россия
Стала известна позиция ФИФА по участию России в отборе на ЧМ-2026,https://lenta.ru/news/2022/12/26/fifa_rus/,2022-12-26,Спорт
Компания друзей оставила официантке 150 тысяч рублей чаевых в честь праздников,https://lenta.ru/news/2022/12/26/bigtips/,2022-12-26,Из жизни
Стала известна стоимость нового электрического «Москвича»,https://lenta.ru/news/2022/12/26/moskvichnoo/,2022-12-26,Экономика
Убившая детей из-за «вселившихся в них бесов» россиянка оставила мужу записку,https://lenta.ru/news/2022/12/26/zapiska/,2022-12-26,Россия
Популярный блогер усомнился в честности розыгрышей гаджетов в соцсетях,https://lenta.ru/news/2022/12/26/petuhov/,2022-12-26,Интернет и СМИ
В США усомнились в существовании Украины как государства,https://lenta.ru/news/2022/12/26/ukrainanebudet/,2022-12-26,Мир
Возлюбленная Роналду показала на видео роскошный подарок футболисту на Рождество,https://lenta.ru/news/2022/12/26/giftedpartner1/,2022-12-26,Ценности
В Екатеринбурге мать убила троих детей при помощи провода,https://lenta.ru/news/2022/12/26/ekb/,2022-12-26,Силовые структуры
Диетолог дала совет по выбору рыбы для новогоднего стола,https://lenta.ru/news/2022/12/26/ryba/,2022-12-26,Забота о себе
В США десятки человек погибли из-за снежной бури,https://lenta.ru/news/2022/12/26/50_usa/,2022-12-26,Мир
В России исключили новогоднее перемирие с Украиной,https://lenta.ru/news/2022/12/26/bez_peremiriya/,2022-12-26,Бывший СССР
Путин назначил Медведева на должность своего первого заместителя в ВПК,https://lenta.ru/news/2022/12/26/putttin/,2022-12-26,Россия
Зеленский рассказал о переговорах с премьером Индии,https://lenta.ru/news/2022/12/26/ze_peace/,2022-12-26,Бывший СССР
Сестра Кейт Мосс объяснила причину нанесения тату на лицо после выхода из рехаба,https://lenta.ru/news/2022/12/26/rehab/,2022-12-26,Ценности
СКР возбудил дело из-за убийства россиянкой дочери и двоих сыновей,https://lenta.ru/news/2022/12/26/ekboficioz/,2022-12-26,Силовые структуры
Отдых россиянина на популярном отечественном курорте обернулся угрозой бешенства,https://lenta.ru/news/2022/12/26/dogs/,2022-12-26,Путешествия
В Казахстане признали роль русского языка,https://lenta.ru/news/2022/12/26/russlang/,2022-12-26,Бывший СССР
В Китае назвали дату открытия границ для туристов,https://lenta.ru/news/2022/12/26/china_travel/,2022-12-26,Путешествия
Леонардо Ди Каприо купил дом соседей после скандала с ними,https://lenta.ru/news/2022/12/26/leo_estate/,2022-12-26,Среда обитания
Опубликован список лучших рождественских фильмов,https://lenta.ru/news/2022/12/26/prazdnik_prihodit/,2022-12-26,Культура
Дженна Ортега отказалась читать строчку по сценарию сериала «Уэнсдэй»,https://lenta.ru/news/2022/12/26/ortegasline/,2022-12-26,Культура
Глава МВД заявил о задержании шестерых граждан с 260 килограммами наркотиков,https://lenta.ru/news/2022/12/26/mvdkolhark/,2022-12-26,Силовые структуры
В кабинете главы Росавиации провели обыск,https://lenta.ru/news/2022/12/26/neradko/,2022-12-26,Силовые структуры
Казахстан передал Украине электрогенераторы,https://lenta.ru/news/2022/12/26/electrokz/,2022-12-26,Бывший СССР
Китаю предсказали лидерство в мировой экономике к 2036 году,https://lenta.ru/news/2022/12/26/recidhfirm/,2022-12-26,Экономика
Отец Трусовой заявил о желании выбирать комментаторов на ее выступления,https://lenta.ru/news/2022/12/26/trusova/,2022-12-26,Спорт
Российские врачи вернули мужчине эрекцию с помощью передовой операции по ОМС,https://lenta.ru/news/2022/12/26/erection/,2022-12-26,Забота о себе
Названы худшие игры для ПК,https://lenta.ru/news/2022/12/26/bad_games/,2022-12-26,Технологии
Соседи рассказали об убившей детей из-за «вселившихся бесов» россиянке и ее муже,https://lenta.ru/news/2022/12/26/sosedy_besy/,2022-12-26,Россия
Продажи белорусских ноутбуков Horizont прекратились через три дня после старта,https://lenta.ru/news/2022/12/26/horizont/,2022-12-26,Экономика
Лавров уличил США в намерении установить «конец истории»,https://lenta.ru/news/2022/12/26/lavrovvsfukuyama/,2022-12-26,Мир
Непослушный мальчик захотел получить новогодние подарки и дал взятку Деду Морозу,https://lenta.ru/news/2022/12/26/santa/,2022-12-26,Из жизни
ФСБ опубликовала имена ликвидированных на границе России украинских диверсантов,https://lenta.ru/news/2022/12/26/imenacos/,2022-12-26,Силовые структуры
Из квартиры убившей троих детей «из-за бесов» россиянки слышали громкую молитву,https://lenta.ru/news/2022/12/26/molitva/,2022-12-26,Россия
Раскрыты популярные у россиян продукты для новогоднего стола,https://lenta.ru/news/2022/12/26/newyeartable/,2022-12-26,Ценности
Стали известны подробности уголовного дела блогерши Белоцерковской,https://lenta.ru/news/2022/12/26/belocerkovskaya/,2022-12-26,Интернет и СМИ
Белорусскую спортсменку приговорили к 12 годам колонии,https://lenta.ru/news/2022/12/26/belgeras/,2022-12-26,Спорт
Кинокритики выбрали лучшие российские сериалы года,https://lenta.ru/news/2022/12/26/showzzzzzz/,2022-12-26,Культура
Названа предположительная стоимость ремонта «Северных потоков»,https://lenta.ru/news/2022/12/26/sevspo/,2022-12-26,Экономика
Южную Корею и КНДР сравнили с двумя баранами из-за напряженности,https://lenta.ru/news/2022/12/26/korean_baran/,2022-12-26,Мир
Россиянам объяснили повышение стоимости жилья,https://lenta.ru/news/2022/12/26/kvadrat/,2022-12-26,Среда обитания
